{
 "version": "1.0",
 "title": "World population by country",
 "metric": "World population by country",
 "unit": "units",
 "valueFormat": "comma",
 "canvas": {
  "width": 1280,
  "height": 720,
  "fps": 60
 },
 "settings": {
  "topN": 12,
  "secondsPerYear": 71.875,
  "scalePower": 0.72,
  "introSeconds": 5,
  "outroSeconds": 8,
  "finalHoldSeconds": 12,
  "layout": "auto"
 },
 "entities": [
  {
   "id": "vatican",
   "name": "Vatican",
   "group": "All"
  },
  {
   "id": "qatar",
   "name": "Qatar",
   "group": "All"
  },
  {
   "id": "sint-maarten-dutch-part-",
   "name": "Sint Maarten (Dutch part)",
   "group": "All"
  },
  {
   "id": "united-arab-emirates",
   "name": "United Arab Emirates",
   "group": "All"
  },
  {
   "id": "andorra",
   "name": "Andorra",
   "group": "All"
  },
  {
   "id": "tokelau",
   "name": "Tokelau",
   "group": "All"
  },
  {
   "id": "monaco",
   "name": "Monaco",
   "group": "All"
  },
  {
   "id": "liechtenstein",
   "name": "Liechtenstein",
   "group": "All"
  },
  {
   "id": "kuwait",
   "name": "Kuwait",
   "group": "All"
  },
  {
   "id": "aruba",
   "name": "Aruba",
   "group": "All"
  },
  {
   "id": "falkland-islands",
   "name": "Falkland Islands",
   "group": "All"
  },
  {
   "id": "northern-mariana-islands",
   "name": "Northern Mariana Islands",
   "group": "All"
  },
  {
   "id": "united-states-virgin-islands",
   "name": "United States Virgin Islands",
   "group": "All"
  },
  {
   "id": "british-virgin-islands",
   "name": "British Virgin Islands",
   "group": "All"
  },
  {
   "id": "turks-and-caicos-islands",
   "name": "Turks and Caicos Islands",
   "group": "All"
  },
  {
   "id": "macao",
   "name": "Macao",
   "group": "All"
  },
  {
   "id": "french-guiana",
   "name": "French Guiana",
   "group": "All"
  },
  {
   "id": "bahrain",
   "name": "Bahrain",
   "group": "All"
  },
  {
   "id": "isle-of-man",
   "name": "Isle of Man",
   "group": "All"
  },
  {
   "id": "luxembourg",
   "name": "Luxembourg",
   "group": "All"
  },
  {
   "id": "jordan",
   "name": "Jordan",
   "group": "All"
  },
  {
   "id": "american-samoa",
   "name": "American Samoa",
   "group": "All"
  },
  {
   "id": "guam",
   "name": "Guam",
   "group": "All"
  },
  {
   "id": "singapore",
   "name": "Singapore",
   "group": "All"
  },
  {
   "id": "cayman-islands",
   "name": "Cayman Islands",
   "group": "All"
  },
  {
   "id": "saudi-arabia",
   "name": "Saudi Arabia",
   "group": "All"
  },
  {
   "id": "mayotte",
   "name": "Mayotte",
   "group": "All"
  },
  {
   "id": "oman",
   "name": "Oman",
   "group": "All"
  },
  {
   "id": "curacao",
   "name": "Curacao",
   "group": "All"
  },
  {
   "id": "hong-kong",
   "name": "Hong Kong",
   "group": "All"
  },
  {
   "id": "anguilla",
   "name": "Anguilla",
   "group": "All"
  },
  {
   "id": "malta",
   "name": "Malta",
   "group": "All"
  },
  {
   "id": "cook-islands",
   "name": "Cook Islands",
   "group": "All"
  },
  {
   "id": "israel",
   "name": "Israel",
   "group": "All"
  },
  {
   "id": "gibraltar",
   "name": "Gibraltar",
   "group": "All"
  },
  {
   "id": "niue",
   "name": "Niue",
   "group": "All"
  },
  {
   "id": "palau",
   "name": "Palau",
   "group": "All"
  },
  {
   "id": "antigua-and-barbuda",
   "name": "Antigua and Barbuda",
   "group": "All"
  },
  {
   "id": "montserrat",
   "name": "Montserrat",
   "group": "All"
  },
  {
   "id": "bermuda",
   "name": "Bermuda",
   "group": "All"
  }
 ],
 "observations": [
  {
   "entity": "Afghanistan",
   "date": "1990",
   "value": 0.47889447
  },
  {
   "entity": "Afghanistan",
   "date": "1995",
   "value": 0.41909462
  },
  {
   "entity": "Afghanistan",
   "date": "2000",
   "value": 0.3771275
  },
  {
   "entity": "Afghanistan",
   "date": "2005",
   "value": 0.3577773
  },
  {
   "entity": "Afghanistan",
   "date": "2010",
   "value": 0.3616026
  },
  {
   "entity": "Afghanistan",
   "date": "2015",
   "value": 1.0032939
  },
  {
   "entity": "Afghanistan",
   "date": "2020",
   "value": 0.3688297
  },
  {
   "entity": "Afghanistan",
   "date": "2024",
   "value": 0.2300487
  },
  {
   "entity": "Albania",
   "date": "1990",
   "value": 2.0138402
  },
  {
   "entity": "Albania",
   "date": "1995",
   "value": 2.1897357
  },
  {
   "entity": "Albania",
   "date": "2000",
   "value": 2.4223442
  },
  {
   "entity": "Albania",
   "date": "2005",
   "value": 2.10454
  },
  {
   "entity": "Albania",
   "date": "2010",
   "value": 1.8022878
  },
  {
   "entity": "Albania",
   "date": "2015",
   "value": 1.7950191
  },
  {
   "entity": "Albania",
   "date": "2020",
   "value": 1.6995398
  },
  {
   "entity": "Albania",
   "date": "2024",
   "value": 1.6612072
  },
  {
   "entity": "Algeria",
   "date": "1990",
   "value": 1.0795872
  },
  {
   "entity": "Algeria",
   "date": "1995",
   "value": 0.9203732
  },
  {
   "entity": "Algeria",
   "date": "2000",
   "value": 0.8093155
  },
  {
   "entity": "Algeria",
   "date": "2005",
   "value": 0.59719867
  },
  {
   "entity": "Algeria",
   "date": "2010",
   "value": 0.6003829
  },
  {
   "entity": "Algeria",
   "date": "2015",
   "value": 0.59839034
  },
  {
   "entity": "Algeria",
   "date": "2020",
   "value": 0.56849706
  },
  {
   "entity": "Algeria",
   "date": "2024",
   "value": 0.554228
  },
  {
   "entity": "American Samoa",
   "date": "1990",
   "value": 45.632504
  },
  {
   "entity": "American Samoa",
   "date": "1995",
   "value": 44.15093
  },
  {
   "entity": "American Samoa",
   "date": "2000",
   "value": 43.816727
  },
  {
   "entity": "American Samoa",
   "date": "2005",
   "value": 42.801632
  },
  {
   "entity": "American Samoa",
   "date": "2010",
   "value": 42.650467
  },
  {
   "entity": "American Samoa",
   "date": "2015",
   "value": 44.466507
  },
  {
   "entity": "American Samoa",
   "date": "2020",
   "value": 47.442776
  },
  {
   "entity": "American Samoa",
   "date": "2024",
   "value": 50.644714
  },
  {
   "entity": "Andorra",
   "date": "1990",
   "value": 73.94148
  },
  {
   "entity": "Andorra",
   "date": "1995",
   "value": 69.16698
  },
  {
   "entity": "Andorra",
   "date": "2000",
   "value": 64.16534
  },
  {
   "entity": "Andorra",
   "date": "2005",
   "value": 64.96687
  },
  {
   "entity": "Andorra",
   "date": "2010",
   "value": 64.49706
  },
  {
   "entity": "Andorra",
   "date": "2015",
   "value": 58.558483
  },
  {
   "entity": "Andorra",
   "date": "2020",
   "value": 58.896355
  },
  {
   "entity": "Andorra",
   "date": "2024",
   "value": 59.078815
  },
  {
   "entity": "Angola",
   "date": "1990",
   "value": 0.28828454
  },
  {
   "entity": "Angola",
   "date": "1995",
   "value": 0.29061055
  },
  {
   "entity": "Angola",
   "date": "2000",
   "value": 0.28470746
  },
  {
   "entity": "Angola",
   "date": "2005",
   "value": 0.32310653
  },
  {
   "entity": "Angola",
   "date": "2010",
   "value": 1.4439559
  },
  {
   "entity": "Angola",
   "date": "2015",
   "value": 2.2451258
  },
  {
   "entity": "Angola",
   "date": "2020",
   "value": 1.962367
  },
  {
   "entity": "Angola",
   "date": "2024",
   "value": 1.7856456
  },
  {
   "entity": "Anguilla",
   "date": "1990",
   "value": 30.59888
  },
  {
   "entity": "Anguilla",
   "date": "1995",
   "value": 34.14659
  },
  {
   "entity": "Anguilla",
   "date": "2000",
   "value": 36.351437
  },
  {
   "entity": "Anguilla",
   "date": "2005",
   "value": 38.183746
  },
  {
   "entity": "Anguilla",
   "date": "2010",
   "value": 38.23904
  },
  {
   "entity": "Anguilla",
   "date": "2015",
   "value": 38.501057
  },
  {
   "entity": "Anguilla",
   "date": "2020",
   "value": 38.503
  },
  {
   "entity": "Anguilla",
   "date": "2024",
   "value": 40.5398
  },
  {
   "entity": "Antigua and Barbuda",
   "date": "1990",
   "value": 19.07367
  },
  {
   "entity": "Antigua and Barbuda",
   "date": "1995",
   "value": 25.73729
  },
  {
   "entity": "Antigua and Barbuda",
   "date": "2000",
   "value": 30.797468
  },
  {
   "entity": "Antigua and Barbuda",
   "date": "2005",
   "value": 31.077364
  },
  {
   "entity": "Antigua and Barbuda",
   "date": "2010",
   "value": 30.9564
  },
  {
   "entity": "Antigua and Barbuda",
   "date": "2015",
   "value": 31.408472
  },
  {
   "entity": "Antigua and Barbuda",
   "date": "2020",
   "value": 31.994862
  },
  {
   "entity": "Antigua and Barbuda",
   "date": "2024",
   "value": 32.496906
  },
  {
   "entity": "Argentina",
   "date": "1990",
   "value": 5.0309563
  },
  {
   "entity": "Argentina",
   "date": "1995",
   "value": 4.5328174
  },
  {
   "entity": "Argentina",
   "date": "2000",
   "value": 4.1485777
  },
  {
   "entity": "Argentina",
   "date": "2005",
   "value": 4.18586
  },
  {
   "entity": "Argentina",
   "date": "2010",
   "value": 4.358772
  },
  {
   "entity": "Argentina",
   "date": "2015",
   "value": 4.2703323
  },
  {
   "entity": "Argentina",
   "date": "2020",
   "value": 4.231491
  },
  {
   "entity": "Argentina",
   "date": "2024",
   "value": 4.2849092
  },
  {
   "entity": "Armenia",
   "date": "1990",
   "value": 12.205107
  },
  {
   "entity": "Armenia",
   "date": "1995",
   "value": 18.806553
  },
  {
   "entity": "Armenia",
   "date": "2000",
   "value": 18.819962
  },
  {
   "entity": "Armenia",
   "date": "2005",
   "value": 15.860157
  },
  {
   "entity": "Armenia",
   "date": "2010",
   "value": 7.1943836
  },
  {
   "entity": "Armenia",
   "date": "2015",
   "value": 6.5349
  },
  {
   "entity": "Armenia",
   "date": "2020",
   "value": 7.165228
  },
  {
   "entity": "Armenia",
   "date": "2024",
   "value": 9.235366
  },
  {
   "entity": "Aruba",
   "date": "1990",
   "value": 22.417084
  },
  {
   "entity": "Aruba",
   "date": "1995",
   "value": 29.33955
  },
  {
   "entity": "Aruba",
   "date": "2000",
   "value": 33.9158
  },
  {
   "entity": "Aruba",
   "date": "2005",
   "value": 34.532528
  },
  {
   "entity": "Aruba",
   "date": "2010",
   "value": 34.28891
  },
  {
   "entity": "Aruba",
   "date": "2015",